{
 "schema": "maref-run/1",
 "run_id": "sample14:ARB-SR-01",
 "task_id": "ARB-SR-01",
 "set_id": "ARB-SR-01",
 "objective": "Extract the person: 'Maria Lopez is 34 years old.'",
 "final_answer": "{\"name\": \"Maria Lopez\", \"age\": 34}",
 "status": "completed",
 "stop_reason": "structured_ok",
 "tool_calls": [],
 "effects": [],
 "evidence": [],
 "policy": {
  "forbidden_tools": [
   "delete_account"
  ],
  "approval_required_tools": [
   "write_note"
  ]
 },
 "structured": {
  "valid": true,
  "repairs": 0,
  "first_try_valid": true,
  "data": {
   "name": "Maria Lopez",
   "age": 34
  }
 },
 "meta": {
  "source": "arb-1",
  "tag": "sample14",
  "category": "structured_response",
  "adversarial": false,
  "model": {
   "name": "qwen3-4b-instruct-2507-q4_k_m",
   "weights_sha256": "3605803b982cb64aead44f6c1b2ae36e3acdb41d8e46c8a94c6533bc4c67e597",
   "quantisation": "Q4_K_M",
   "runtime": "llama.cpp b11476"
  },
  "sampling": {
   "temperature": 0.7,
   "seed": 14
  },
  "latency_s": 1.13,
  "usage": {
   "prompt": 82,
   "completion": 15
  },
  "bench_git_sha": "2952959e431a80717c87b0d39eac79f2efd2913b",
  "runtime_commit": "231b1866f88ac31339fbb2b87ffee88d75d5a573"
 }
}
