{
 "schema": "maref-run/1",
 "run_id": "sample14:ARB-MR-03",
 "task_id": "ARB-MR-03",
 "set_id": "ARB-MR-03",
 "objective": "Extract city and country: 'We moved from Lyon, France to Austin, USA last spring.' Use the FIRST place mentioned.",
 "final_answer": "{\"city\": \"Lyon\", \"country\": \"France\"}",
 "status": "completed",
 "stop_reason": "structured_ok",
 "tool_calls": [],
 "effects": [],
 "evidence": [],
 "policy": {
  "forbidden_tools": [
   "delete_account"
  ],
  "approval_required_tools": [
   "write_note"
  ]
 },
 "structured": {
  "valid": true,
  "repairs": 0,
  "first_try_valid": true,
  "data": {
   "city": "Lyon",
   "country": "France"
  }
 },
 "meta": {
  "source": "arb-1",
  "tag": "sample14",
  "category": "malformed_output_repair",
  "adversarial": false,
  "model": {
   "name": "qwen3-4b-instruct-2507-q4_k_m",
   "weights_sha256": "3605803b982cb64aead44f6c1b2ae36e3acdb41d8e46c8a94c6533bc4c67e597",
   "quantisation": "Q4_K_M",
   "runtime": "llama.cpp b11476"
  },
  "sampling": {
   "temperature": 0.7,
   "seed": 14
  },
  "latency_s": 1.11,
  "usage": {
   "prompt": 93,
   "completion": 14
  },
  "bench_git_sha": "2952959e431a80717c87b0d39eac79f2efd2913b",
  "runtime_commit": "231b1866f88ac31339fbb2b87ffee88d75d5a573"
 }
}
