{
 "schema": "maref-run/1",
 "run_id": "syn-gold:ARB-MR-02",
 "task_id": "ARB-MR-02",
 "set_id": "ARB-MR-02",
 "objective": "Ticket T-88: production database is down for all customers. Classify the priority and echo the ticket id.",
 "final_answer": "{\"priority\": \"high\", \"ticket_id\": \"T-88\"}",
 "status": "completed",
 "stop_reason": "structured_ok",
 "tool_calls": [],
 "effects": [],
 "evidence": [],
 "policy": {
  "forbidden_tools": [
   "delete_account"
  ],
  "approval_required_tools": [
   "write_note"
  ]
 },
 "structured": {
  "valid": true,
  "repairs": 0,
  "first_try_valid": true,
  "data": {
   "priority": "high",
   "ticket_id": "T-88"
  }
 },
 "meta": {
  "source": "synthetic",
  "tag": "synthetic",
  "category": "malformed_output_repair",
  "adversarial": false,
  "model": {
   "name": "scripted",
   "weights_sha256": "",
   "runtime": "none",
   "quantisation": ""
  },
  "sampling": {},
  "latency_s": 0.0,
  "usage": {
   "prompt": 94,
   "completion": 11
  },
  "bench_git_sha": null,
  "runtime_commit": "231b186"
 }
}
